questions,answers,classes
公司制度想让我走——我2013年3月份毕业来到公司实习当时入职的时候签了一份合同，当时公司说实习三个月然后转正式员工，因为当时年纪小不太了解劳动法，公司到了转正期间也没有跟我签劳动合同上社保，在当年11月份因为工作改变把我掉去别的岗位，我当时要求公司给我上社保，但是公司不给上，然后到了2018年10月份公司改革，说我不是公司员工想让我自动走但是我有工资打卡记录还有拿现金工资的记录请问律师如果这样公司不给我补偿并且要求我离职怎么算,你可以向公司所在地劳动仲裁委员会申请仲裁，第一、要求公司支付未签订书面劳动合同的11个月的双倍工资，第二、要求工资支付经济补偿金，工作每满一年，支付一个月的工资作为经济补偿金，第三、补缴相关保险费。,未知
老板骗我们辞职该怎么办！——我是某家具公司实习的，6月份刚签了2年的劳动合同，老板以公司破产为由，骗我们签自愿辞职书，虽然发放了拖欠的工资，但总感觉我们被骗了，因为公司根本没破产，只不过是骗我们自己辞职，我们该如何通过法来维护自正的正当权益。,因受欺诈而辞去工作的情形属于民法上所称的因违背真实意思表示而作出的民事行为；在劳动法领域内，实务中的做法通常是要求用人单位给付其依法应当支付的“经济补偿金”，而不是撤销解除劳动合同的协议，然后要求用人单位继续聘用劳动者。当然，劳动者也可以主张用人单位继续履行原劳动合同，但要考虑再回去工作后的心理感受。此过程中，劳动者维权的关键在于证明被欺诈而作出“辞职”的意思表示的证据。只要证据充分，即可认定用人单位一方是违法解除劳动合同。,未知
公司拖欠120多名员工工资，4个月至今没有消息——董事长拖欠120多名员工，工资4个月，一直没有消息，当地上诉也没有什么消息,建议你方先向当地劳动监察部门投诉该单位，以期获得问题的最快解决。当然，任何问题的解决均需要一定的时间，这背后相关工作人员的调查取证、沟通协调均需经过相当的程序，故请你方耐心等待处理结果。此外，需要提示你方的是：务必保存好相关证据，对拖欠工资的数额、时间等关键证据要注意收集、固定，以备不时之需。,未知
装载机造成我家经济损失——我家叫装载机推房，装载机将后墙推到后砸到邻居家的墙上，将邻居家的墙，大门东子砸歪，人家要赔偿，装载机司机有什么责任，谢谢,您好，法律服务组7为您解答。您描述的这种情况属于侵权纠纷。按照您的描述，如果装载机的司机和您之间是雇佣关系，那么您需要对装载机司机给邻居造成的侵犯财产权的纠纷承担责任，但是您可以向装载机司机进行追偿。根据我国侵权责任法第十九条“侵害他人财产的，财产损失按照损失发生时的市场价格或者其他方式计算”；第二十条“侵害他人人身权益造成财产损失的，按照被侵权人因此受到的损失赔偿；被侵权人的损失难以确定，侵权人因此获得利益的，按照其获得的利益赔偿；侵权人因此获得的利益难以确定，被侵权人和侵权人就赔偿数额协商不一致，向人民法院提起诉讼的，由人民法院根据实际情况确定赔偿数额”；第三十五条“个人之间形成劳务关系，提供劳务一方因劳务造成他人损害的，由接受劳务一方承担侵权责任。提供劳务一方因劳务自己受到损害的，根据双方各自的过错承担相应的责任”。,未知
劳动纠纷——我实际工资加绩效等收入4000多元，但我社保缴费基数2500(我市社保基数公布的2500)请问我能以缴费基数不合法为由单方解除劳动合同吗，我毕竟实际收入4000多？？能得到什么赔偿？？,您好，法律服务组7为您解答。按照您描述的这种情况，比较常见。一般情况下，单位会以您和单位签订的劳动合同上面的数字为准，来作为社保缴纳的基数。如果您觉得不合适的话，您可以提起劳动仲裁来维护权利。,未知
工厂招聘两倍工资上班7天就没有双倍工资吗——在工厂上班7七天半，当时厂区招聘写的是第一个月是两倍的工资，服装厂因为是计件的嘛，做了一个礼拜就辞职了，请问是像厂里说的那样只给计件的工资吗？去了一个礼拜就给2百多块钱的计件工资。本人电话18368004030,您好，法律服务组7为您解答。按照您的描述，这种情况如果在招聘的时候说明第一个月是双倍工资，则应当可以理解为入职工作一个月可以要求双倍工资，而您的情况是您是在第一个月只工作了7天，那么站在工厂的方面可能不会按照招聘时候的要求去支付您双倍的工资，毕竟您没有工作满一个月。但是具体工资如何支付，建议您与工厂进行协商，此外您还可以通过申请劳动仲裁的方式来维护您的合法权益。,未知
在工作的地方工作一个多月不发工资——没签合同的情况下在一个地方工作了一个多月，之前工资什么的说的好好的，就一直不发工资，拖欠工资。,1、劳动者正常辞职分两种方式：一是，劳动者主动提出解除劳动合同，二是，劳动者因单位存在违法行为被迫提出解除劳动合同，不用提前30天，也不用批准，可以立马走人。2、如果是因为劳动者被迫解除劳动合同的，用人单位还必须按照劳动合同法第十六条第四十七条的规定，支付每工作一年一个月工资的经济补偿金；3、劳动者提前30天（试用期提前3天）书面通知用人单位，可以解除劳动合同；如果您提前30日日书面向用人单位提出了离职，30日期限届满后就可以离职，用人单位不配合办理离职亦不影响，当中造成的损失由公司自行承担；,未知
我交了农保，社保就不交，劳动合同是否有效——没交社保的劳动合同是否有效。我自动离职是不是违反合同。有没有补偿金,"不合法,建议向当地的社保机构投诉.",未知
人事档案丢失。——由于原单位违犯了《档案法》第二十四条第一项之规定，将本人档案丢失，直接导致我现在老年生活没有保障。根据最高人民法院，关于人事档案被原单位丢失后当事人起诉原用人单位补办人事档并赔偿经济损失是否受理的复函，我找了江陵县法律援助中心，可是，段辉忠律师说不属于他管。我一个靠吃国家低保的，一个月235元的低保费，哪有钱去请律师，为此，特请求您们给予帮助！,您好，法律服务组7为您解答。按照您的描述，对方欠债不还的行为属于违反合同的行为，建议您先与对方进行协商，要求对方及时偿还其欠款，如果协商未能解决问题，您可以请求公安机关帮助解决，如果仍不能拿到欠款，您则可以向法院起诉，要求超市承担相应的责任。相关法条：《中华人民共和国合同法》第一百零七条当事人一方不履行合同义务或者履行合同义务不符合约定的，应当承担继续履行、采取补救措施或者赔偿损失等违约责任。第一百零八条当事人一方明确表示或者以自己的行为表明不履行合同义务的，对方可以在履行期限届满之前要求其承担违约责任。,未知
邯郸民生银行无故扣压社保关系怎么办——我孩子原在邯郸民生银行工作，因其无故拖欠工资报酬于2014年6月向银行提出辞职，劳动合同已解除，但至今邯郸民生银行一直扣压着社保关系不给转。联系电话；13731026863,索赔金额是按照伤残的情况来确定的。可以私了，如果不能私了的，那就法律途径来解决。,未知
工伤三年后确定残疾——尊敬的律师：您好！我的一位亲戚于2012年在工作中摔落致左脚矩骨粉碎性骨折，当时公报销全部医疗费，但没有申请工伤，后面一直未痊育，现在一直疼痛，不能去上班，左脚需靠拐杖走路，他为家里唯的劳动力，请问这种情况能否申请公司赔偿？年底刚在原来公司辞职。,你好！法律服务组4来为你解答。你好，劳动局没有履行职责责令用人单位按时给你发放工资的，你还可以向人民法院申请支付令，由法院依法发出支付令，用人单位应当履行支付令，未履行的，你可以申请人民法院强制执行。你也可以向劳动仲裁委员会申请劳动仲裁。相关法条：《中华人民共和国劳动法》第九十一条用人单位有下列侵害劳动者合法权益情形之一的，由劳动行政部门责令支付劳动者的工资报酬、经济补偿，并可以责令支付赔偿金：（一）克扣或者无故拖欠劳动者工资的；（二）拒不支付劳动者延长工作时间工资报酬的；（三）低于当地最低工资标准支付劳动者工资的；（四）解除劳动合同后，未依照本法规定给予劳动者经济补偿的。第七十七条用人单位与劳动者发生劳动争议，当事人可以依法申请调解、仲裁、提起诉讼，也可以协商解决。调解原则适用于仲裁和诉讼程序。《中华人民共和国劳动合同法》第三十条第二款用人单位拖欠或者未足额支付劳动报酬的，劳动者可以依法向当地人民法院申请支付令，人民法院应当依法发出支付令。,未知
因工作左脚矩骨粉碎性骨折现可否申请赔偿——律师：您好！我一位亲戚，2012年因工作摔倒，导致左脚矩骨粉碎性骨折，当时公司因有买保险，有支付所有的医疗费，但没有申请工伤鉴定，以致当时没有获得赔偿。一直到2015年1月都还在该公司上班，但是其间脚断断续续都在疼，现在经医院诊断为关节炎，疼到无法去上班，需靠拐杖走路，只好辞职在家。我的亲戚今年才27岁，男，母亲60岁，都是农村户口，他没上班家里就断了经济来源。这种情况可否申请公司给予赔偿？急盼回音,你好！法律服务组4来为你解答。你好，你亲戚虽未与工厂签订劳动合同，但如果有相关证据来证实，也是可以认定你亲戚与工厂存在事实劳动关系的。在工作中遭受身体损害，是可以按照工伤来处理的，工厂没有给你亲戚申请工伤认定的，你亲戚本人或者其近亲属可以向当地社会保险行政部门申请工伤认定。工厂没有与你亲戚签订劳动合同，应当也是没有给你亲戚缴纳社会保险费，经申请认定为工伤以后，工厂应当按照法律规定，按照工伤待遇的标准给你亲戚支付相关工伤待遇。你们可以先向劳动仲裁委员会申请劳动仲裁，以确认你亲戚与该工厂存在劳动关系，然后申请工伤认定。相关法条：《工伤保险条例》第十四条职工有下列情形之一的，应当认定为工伤：（一）在工作时间和工作场所内，因工作原因受到事故伤害的。第十七条第二款用人单位未按前款规定提出工伤认定申请的，工伤职工或者其近亲属、工会组织在事故伤害发生之日或者被诊断、鉴定为职业病之日起1年内，可以直接向用人单位所在地统筹地区社会保险行政部门提出工伤认定申请。第三十条职工因工作遭受事故伤害或者患职业病进行治疗，享受工伤医疗待遇。第六十二条第二款依照本条例规定应当参加工伤保险而未参加工伤保险的用人单位职工发生工伤的，由该用人单位按照本条例规定的工伤保险待遇项目和标准支付费用。第三款用人单位参加工伤保险并补缴应当缴纳的工伤保险费、滞纳金后，由工伤保险基金和用人单位依照本条例的规定支付新发生的费用。《劳动和社会保障部关于确立劳动关系有关事项的通知》一、用人单位招用劳动者未订立书面劳动合同，但同时具备下列情形的，劳动关系成立。（一）用人单位和劳动者符合法律、法规规定的主体资格；（二）用人单位依法制定的各项劳动规章制度适用于劳动者，劳动者受用人单位的劳动管理，从事用人单位安排的有报酬的劳动；（三）劳动者提供的劳动是用人单位业务的组成部分。二、用人单位未与劳动者签订劳动合同，认定双方存在劳动关系时可参照下列凭证：（一）工资支付凭证或记录（职工工资发放花名册）、缴纳各项社会保险费的记录；（二）用人单位向劳动者发放的“工作证”、“服务证”等能够证明身份的证件；（三）劳动者填写的用人单位招工招聘“登记表”、“报名表”等招用记录；（四）考勤记录；（五）其他劳动者的证言等。其中，（一）、（三）、（四）项的有关凭证由用人单位负举证责任。五、劳动者与用人单位就是否存在劳动关系引发争议的，可以向有管辖权的劳动争议仲裁委员会申请仲裁。,未知
政策性关停职工怎么安置——政策性关停小火电股份公司，职工怎么安置,你好，应该报当即建委或者请专业机构做质量鉴定查找原因之后再确定如何维权。,未知
关于无固定期合同的员工社保买断的问题——北京户口员工在内资企业已经15年以上，已经无固定期合同，企业要清算，问问是否能够要求企业买断社保医疗,你可以收集相关证据，通过法律途径来解决。必要时向公安机关报警解决。,未知
"劳动合同中另行约定工龄补贴方式是否有效——我司与公司员工每年签署一次固定期限的劳动合同,合同期限为1年。我司与员工签署的劳动合同中，第12条双方需要约定的其他事项中，明确约定“每年劳动合同期满即发放一个月工龄补贴工资，并协商是否签订新一年的劳动合同，后续不计连续工龄补贴”，该合同经公司和员工双方签字确认。请问：1、该劳动合同中的另行约定工龄补贴方式的条款是否有效？2、如有效，这是否可以作为劳动争议的免予经济补偿的证据？望复.公司邮箱:hegnxin9@gmail.com",从你描述的情况看，应该是一起合同纠纷，你可以与对方协商，要求其付清费用，在协商过程中，注意收集证据，如当事人证言，也可以把协商的过程录音，证明你所讲的事实，之后通过诉讼解决，建议抓紧时间，因为时间过长可能超过诉讼时效．,未知
癌症患者——我是中石化安徽阜阳分工司的一名普通加油工。在加油站连续工作了17年。今年5月被查出得了甲状腺癌，现在在请病假。可公司给我的病假工资每月才500-600元。根本不够我每月的生活费，更不够我治病跟吃药的钱。我去找公司，也没人管我。我该怎么办，作为世界500强的中石化。这样对待以为老职工，是不是太残忍了，能否申请法律援助帮帮我。,职工内退属于政策性规定，按当地的政策处理。,未知
"工地上班受伤——我哥在莆田正荣财富中心工地上班被弄到左手食指中指各断一节老板只赔一万该怎么办你好王律师！我哥哥26岁，在工地上班中被弄断左边食指跟中指手指无名指也粉碎性骨折手指已经各断一节多做手术住院一个星期老板就叫出院了说在工地修养也一样，我们不同意说还很疼还没有好医生也还没有叫出院,医生说最少两周才可以出院，线都还没有拆万一出院发炎怎么办,后来老板说那你不出院也可以然后医药费这些都不付了,后来我们没有办法只能跟老板借自己工资付医药费,不是我们故意赖在医院不出来而是根本不到出院时候他就说该出院是你不出院当然你自己付钱了,然后现在本月了可以出院了我们出院了他说给我哥交了人身意外保险了，叫我拿单子给他交到保险工司理赔可说我哥出事到现在保险工司都没有来看现场也没有来了解我就怕他骗我们我没有给单子给他自己要去工伤认定可劳动局说老板说对的可以出院就出院没有必要浪费那么多钱在医院里面然后不给我哥做工伤认定,现在这样情况我们该怎么办呢?,请问这样的情况在莆田应该可以评到几级伤残?大概能得到多少赔偿呢26岁本人急需尽快解决为了哥哥的事情我已经快一月没有上班了钱也花光了，今天打电话给老板他说药费他已经付了最多给一万多，说他只负责百分之三十百分之七十由我们几个老乡承担这样做法对吗？叫我哥哥去做的是一个老乡是他跟老板签合同的这样该怎么办呢我们已经跑很多部门都推来推去的我们没有怎么钱家里这么穷现在还没有娶老婆手指断了以后更难娶老婆了这样的打击对于我们来说是要命的该怎么办呢？这样情况如果请律师能赢官司吗又能赔偿多少呢希望律师能帮帮忙无一点头绪也没有了跑信访局几次劳动局去几家都没有用叫我自己去查老板公司叫怎么可是老板没有公司，叫我查发包的公司可是我问根本没有那家愿意告诉我们，现在我们走头无路了政府部门都不管我们还能去那里寻求到帮助呢让我感觉到好绝望无奈，希望律师能帮帮忙谢谢了",这样做并不合法，经济裁员应该给予相应的经济补偿金，如你们与之协商不成，可以采取劳动仲裁的方式维护自己的权利。,未知
劳动补偿——劳动合同期满，劳动者不愿续签劳动合同，劳动者可以获得哪些补偿？社会保险怎么处理,不知签订了劳动合同没有，如果有，建议向当地的劳动部门投诉。,未知
因项目停产可以要求公司解除劳动合同吗——我公司有一个纺织项目（生产服装商标），目前已经歇业停产（具体表现为：凡是今年6月30日合同到期的员工均无一人续签合同，全部走人!主要设备中有几台已经转让，其余设备均与买家谈妥近日即可运走！原材料大部分已经转卖！）。因为停产本人的工作岗位已经不复存在，为此6月28日项目的主管口头与我协商准备调动本人的工作岗位，我当时就明确答复不愿意调往该工作岗位，并要求公司因为项目停产和我解除劳动合同关系和经济补偿（按工作四年补偿四个月的工资。）但是公司方面以设备目前还在及安排来料加工整理袜子的工作为由，不愿意解除劳动合同。后来经过反复协商公司方面只愿意补偿一个月的工资。请问我能够要求公司解除劳动合同并补偿四个月的工资吗？,当然应当享受与正常工作期间的绩效工资。,未知
"在职人员离岗退养后政府变卦怎么办——我们是当地旗政府于1998年4月份将行政事业单位上班的大约200名在职人员依据当时的“分流政策”办了“离岗退养”手续，并且作了公证。可是旗政府在按照《离岗退养公证书》兑现承诺了5年后就开始“变卦”了。目前这些离岗退养人员在2003年10月份以来的多次调资中每人每月被克扣的工资在1000元以上。当问题出现后，我们离岗退养人员曾次找旗市两级政府交涉，但旗市两级政府总是以种种借口推诿，致使问题至今得不倒决。1998年当时伊盟盟委办公室，伊盟行署办室，伊党办发（1998）3号文件《伊克昭盟机关事业单位人员分流暂行办法》中指定的“离岗退养期间工龄连续计算，除基本工资按照规定比例发外，不在享受年终奖金，特殊岗位津贴，劳保待遇和单位福利，其他津贴.调资.医疗等待遇均按在职人员一样对待”使把此话给司法部们真实，每个退养人员作了“公证”。但是鄂尔多斯市2008年度《鄂尔多斯市财政局.鄂尔多斯市人事局关于2008年规范公务员津贴有关事宜的通知》中第四条第四款规定“退养人员比照退休人员发放”的指示。不到几年撇开当时的公证约定，单方违规违约，采取欺诈瞒哄的手段将我们这些国家工作人员推下工作岗位，这样的政府咋能依法行政，取信于民呢？《中华人民共和国合同法》第八条规定“依法成立的合同对当事人具有法律约束力。当事人应当按照约定履行自己的义务，不的擅自变更或解除合同。依法成立的合同受法律保护”。由此看来旗市两级政府在把这些离岗退养人员工资待遇的问题上不只是违规违约，失信于民，还是一起违反,《合同法》的行政违法案例。《法制网》编辑，我们没有办法的情况下反应我们的实际问题，只好向新华通讯社新闻媒体暴露，恳请尽快予以调查核实，为民做主，讨回公道！做出合理合法，公正严肃的处理，以免造成更大不良的社会影响。切！切！切！此致：内蒙.鄂尔多斯市.鄂托克前旗全体（98年）退养人员",您好，公司克扣或者拖延支付劳动报酬，或者未签订劳动合同，不缴纳社会保险的都不属于工伤，但作为劳动者可以向劳动部门投诉或者举报。而且您所陈述的公司的相关行为都是违反劳动合同法的。,未知
以下两个文件是否已经废止——律师同志：《中华人民共和国劳动保险条例实施细则(修正草案)》<<中华人民共和国劳动保险条例>>这两个文件是否已经废止？一次性抚恤金和救济金的涵义是什么？,这种情况你可以直接向劳动人事部门进行投诉就行了。,未知
停厂拖欠工资——老板停厂拖欠半年工资,你好！是否是工伤首先要看是不是在工作过程中受到的伤害，其次是看是不是单位指派其他任务受到的伤害，最后看是不是因为单位的利益受到的伤害,未知
我怎么要回我的钱——请问.我带资做了一个工地的扶手.空调架工程.可没订合同.可钱一直没给.我怎么要回我的钱.谢谢.,"你好!从受伤之日爱起一年内必须申报工伤,超过时间不能申报,工伤性质认定下来后在进行伤残鉴定,最后工伤待遇赔偿",未知
因搬家被子丢了怎样解决——我十一月二日让骆驼搬家公司搬了一次家结果丢了一床被子，因这床被子对我有重大意义，我应怎么办。,你好，你可以保全相关证据材料证明你的事实，向单位所在地，合同履行地等的劳动仲裁委申请仲裁,未知
没劳动合同工资银行转账单能作为证据吗——我在一家公司工作了3年没有劳动合同没有工资卡请问农商银行的转账能作为证据起诉公司吗？,你们可以向厂方、公安机关、劳动部门去投诉举报。,未知
我是否能得没离职前的工资补发——我于10月15日离职，公司有5-9月的工资补发；请问我是否能得到这补发,到单位所在地劳动监察大队请他们帮助,未知
