questions,answers,classes
"讨要工程款未果反被诬告诈骗——讨要工程未果反被诬告涉嫌诈骗2011-09-2706:442010年11月25日，美丽的冰城哈尔滨发生了一件令人义愤填膺的怪事----来哈打拼的农民工董希财讨薪不成却被诬告诈骗而遭到警察的强制“逮捕”。2010年9月，董希财和哥哥在刘振龙的手里分包了哈尔滨市香坊区政府开发建设的对俄贸易开发区部分工程（此工程没有任何审批手续，而且，在施工过程偷工减料）。刘振龙系轰动全国的由江泽民总书记亲自督办的发生在哈尔滨市东海龙宫洗浴中心袭警案的参与者，主犯刘金龙的哥哥（至今在押).2010年，刘振龙用不正当手段承揽了香坊区政府的工程。刘振龙本身没有任何施工资质，只是挂靠哈尔滨市第六建筑工程公司第十一分公司，区政府主任刘汉忠，刘虹明知道此情况还是将工程交给了刘振龙建设。董希财施工了两个多月，刘振龙（实际是区政府)仅拨付30万的工程款，百万余款却迟迟不给。2010年11月25日上午，董希财接到十一分公司副指挥郑秋成的电话让其到指挥部结算工程款，上午十时左右，董和几个管理人员去了指挥部，可是，他们刚进屋不久就冲进几个人用手铐将董希财反铐，并用手枪顶住脑袋强行塞进轿车拉到了哈尔滨垦区公安局香坊分局派出所进行了20多分钟的审查确认其无罪后又将董希财铐在一个小屋的暖气片上达十二个多小时，迫于压力，所长崔杰才把董放了，董出来时手腕红肿，耳后也被手枪顶破(有照片）。事后崔杰在接受记者采访时说董的伤是其自己弄的，他们手里是拿枪了，担没有开枪，开枪才叫使用枪支（）。刘振龙这一计划失败后开始玩黑的了。自2011年3月开始，所长崔杰多次授意民警李义民开警车帮刘振龙带领二十多个小弟到工地驱赶工人，黑龙江省公安厅七处退休警察杨玉江也多次手持警棍帮刘行凶打人（伤者有验伤报告）。4月25日，董希财及其工人被他们强行赶出了工地，他们还扣押了董希财的40多万元的设备，建筑材料及生活用品。董希财被赶出工地后，原来给他干五项人工的李德江在刘振龙的安排下继续施工，李德江被刘振龙收买后私刻了董公司的公章又伪造了有关材料在区政府提取了40万的工程进度款，而且，这笔款竟然在派出所交接的，所长崔杰说这事很正常。2010年02,06日，黑龙江晨报，黑龙江日报分别报道了此事，董希财也多次向有关部门反映情况，可是至今依然没有说法。董希财13313664048",你好，建议你去要求对方给你出具皮瓣移植手术不属于植皮手术的事实依据与法律依据来，否则，你就可以依法去申请工伤认定了。,未知
离职后16天受伤可找公司索赔吗——因公司不买社保于9月21号离职。{也没签劳动合同）于10月7日受伤。（动脉。筋。肌腱断。两手指受伤）可找原公司说赔偿吗？有时间期限吗？,您好！法制网-法律问答服务团队为您解答如下：一、具体解析：你所说你们单位这种做法是违法的，根据规定，单位录用职工的，应当自录用之日起30日内到住房公积金管理中心办理缴存登记，并持住房公积金管理中心的审核文件，到受委托银行办理职工住房公积金账户的设立或者转移手续。单位应当按时、足额缴存住房公积金，不得逾期缴存或者少缴。对缴存住房公积金确有困难的单位，经本单位职工代表大会或者工会讨论通过，并经住房公积金管理中心审核，报住房公积金管理委员会批准后，可以降低缴存比例或者缓缴；待单位经济效益好转后，再提高缴存比例或者补缴缓缴。如果单位存在违法行为，你可以向住房公积金管理中心举报，根据规定，违反本条例的规定，单位不办理住房公积金缴存登记或者不为本单位职工办理住房公积金账户设立手续的，由住房公积金管理中心责令限期办理；逾期不办理的，处1万元以上5万元以下的罚款。二、法条依据：第十五条单位录用职工的，应当自录用之日起30日内到住房公积金管理中心办理缴存登记，并持住房公积金管理中心的审核文件，到受委托银行办理职工住房公积金账户的设立或者转移手续。单位与职工终止劳动关系的，单位应当自劳动关系终止之日起30日内到住房公积金管理中心办理变更登记，并持住房公积金管理中心的审核文件，到受委托银行办理职工住房公积金账户转移或者封存手续。第二十条单位应当按时、足额缴存住房公积金，不得逾期缴存或者少缴。对缴存住房公积金确有困难的单位，经本单位职工代表大会或者工会讨论通过，并经住房公积金管理中心审核，报住房公积金管理委员会批准后，可以降低缴存比例或者缓缴；待单位经济效益好转后，再提高缴存比例或者补缴缓缴。,未知
劳动争议咨询——企业为了规避用工风险，2007年12月27日即《劳动合同法》实施前三个工作日，开会通知，额外支付1000元人民币，立即解除已有13年工龄职工的劳动合同。法律依据：《劳动法》第26条第3款。法定事由：职工不同意劳务派遣。企业要求必须签订劳务派遣合同，否则解除劳动合同。争论焦点：一、事由。全国人大法工委副主任、全国总工会办公厅认为违法。省、市、县、三级人民法院、县劳动仲裁委员会认为合法。1、职工不同意劳务派遣，是职工不同意解除与企业的劳动合同，那么企业就以此为由解除与职工的劳动合同。2、职工不同意劳务派遣，企业就解除与职工的劳动合同。是否符合《劳动法》第26条第3款规定。二、法律程序。法院认为程序违法不影响法律执行效力，判决2007年12月27日解除劳动合同，合法有效。1、企业额外支付1000元`人民币，解除劳动合同时间是否立即生效。即2007年12月27日。2、企业不依据《劳动法》第26条规定，一个月后（即2008年1月27日）解除13年工龄职工劳动合同，是否规避《劳动合同法》。3、企业额外支付1000元`人民币，不执行法律规定“提前一个月书面通知”，合法有效。是否与《宪法》第五条相抵触。邮箱meng.1972@yahoo.cn,应当算工伤，单位如果不配合，你们可以自己到劳动行政部门申请做工伤认定。,未知
拖欠工程款——我是个体我给某宾馆安装的排风管道我在期限内完工可是对方迟迟不付欠款~我们有合同,您好！法制网-法律问答服务团队为您解答如下：一、具体解析：你这个表述非常简略，就土地承包产生的争议，根据规定，双方当事人可以通过协商解决，也可以请求村民委员会、乡（镇）人民政府等调解解决。当事人不愿协商、调解或者协商、调解不成的，可以向农村土地承包仲裁机构申请仲裁，也可以直接向人民法院起诉。你可以通过上述途径来解决。二、法条依据：《土地承包法》第五十一条因土地承包经营发生纠纷的，双方当事人可以通过协商解决，也可以请求村民委员会、乡（镇）人民政府等调解解决。当事人不愿协商、调解或者协商、调解不成的，可以向农村土地承包仲裁机构申请仲裁，也可以直接向人民法院起诉。第五十二条当事人对农村土地承包仲裁机构的仲裁裁决不服的，可以在收到裁决书之日起三十日内向人民法院起诉。逾期不起诉的，裁决书即发生法律效力。,未知
手机报-姨夫打工受伤如何要求赔偿——手机报用户尾号5857—您好！我想咨询一下，我的姨父在外打工，工作时被机器切伤致残，我们可不可以要求工地老板赔偿？可以要求哪些方面的赔偿？2011-10-1117:43:05内蒙古呼和浩特,只要是上班工作期间受伤，应当算是工伤。,未知
关于工厂保险补偿——我想问一下在一个工厂有七八年工龄，一直没有买保险，关于工厂保险补偿.,你好！如果你是因为单位变更地址而自己离职的，按照法律规定一般是没有经济补偿金的。但是，你可以和单位协商单位解除你的劳动关系，那么你将获得工作每满一年支付一个月工资的经济补偿金。不知道单位给你办理社会保险没有，如果没有，你可以单位没给你参加社会保险而要求解除劳动关系，单位应当支付经济补偿金。至于单位没有和签定劳动合同，对于本案来讲没有多大的影响。,未知
单位倒闭了我该咋办——我在单位干了二十年了，现在单位被政府要求停产，要盖楼。我能要求哪些钱？,您好！法制网-法律问答服务团队为您解答如下：一、具体解析关于劳动派遣，我国《劳动合同法》中对此有专章规定，其中规定了被派遣劳动者享有与用工单位的劳动者同工同酬的权利。用工单位无同类岗位劳动者的，参照用工单位所在地相同或者相近岗位劳动者。就你所说的社会保险问题，如果用人单位没有依法为你缴纳社会保险的，你可以要求其为你补缴。二、法条依据：《劳动合同法》第六十三条被派遣劳动者享有与用工单位的劳动者同工同酬的权利。用工单位无同类岗位劳动者的，参照用工单位所在地相同或者相近岗位劳动者的劳动报酬确定。,未知
怀孕后公司强制我调岗可以拒绝吗——进入公司差不多一年半，职位是人事专员。近期公司得知我怀孕后就故意把我原来负责的工作全部分派出去，让我什么也不做，逼我辞职。看我没有辞职的打算后又决定将我调到跟原来工作完全不相干的客服部去。我不想去，请问我可以拒绝吗？还有以下几点要说明：1，当初入职时劳动合同有约定是从事“人事管理”的工作，薪资约定的是当时的基本工资，但之后的一次加薪并未有明文约定，只能提供银行的工资记录。公司现在在无法与我协商一致的情况下单方面调岗，应该是违反了原来的劳动合同。我曾提出调我去那边也可以，但要重新签劳动合同，把我的工资和福利、奖金都写明，公司也不同意跟我重新签。所以我只能拒绝。2，公司的奖金是根据绩效考核半年发放一次，因为我现在无事可做，他们现在每个月把我的绩效考核都评分很低，以此让我少拿奖金，我有什么办法可以应对？3，公司以后还可能使用哪些合法的手段逼我？我又该如何应对？谢谢大家。。,网友可依如下规定，尽快申请工伤认定：职工发生按照职业病防治法规定被诊断、鉴定为职业病，所在单位应当在二十四小时内通知统筹地区劳动保障行政部门及其参保的社会保险经办机构，并自被诊断、鉴定为职业病之日起三十日内，向统筹地区劳动保障行政部门提出书面工伤认定申请。遇有特殊情况，经报劳动保障行政部门同意，申请时限可以适当延长。用人单位未按前款规定提出工伤认定申请的，该职工或者其直系亲属、工会组织在被诊断、鉴定为职业病之日起一年内，可以直接向用人单位所在地劳动保障行政部门提出工伤认定申请。,未知
在辞职的时候公司不退回扣押我的工资——我在一工厂做学徒工，期限为三年。但在这三年中每个月要从我月工资中扣三百元，三年期满后退还给我。我让公司给我打个证明但现在公司负责人不给打证明。如果三年期限满后，公司不退回我扣押的工资，那该怎么办呢？,你说的情况，既属于交通事故，也属于工伤事故。但对于工伤事故有一定条件的限制。,未知
如何证明假名和真名是同一个人——如何能够证明用假名的人和真实名字是同一个人？比如与单位或者个人签协议时用王刚。但是他的真实名字叫王洪刚。联系方式:yangconglio613@126.com,你好，北京田洪涛律师解答如下：根据我国《劳动合同法》第四十二条之规定，用人单位不得在劳动者孕期、产期、哺乳期解除劳动关系，否则承担违法解除劳动关系的法律责任。可以申请劳动仲裁。,未知
"手机报－公司这样的作法是否违法——手机报用户尾号5351--个税是否在餐费、社保费等相关费用达到2000元就要扣吗?如果要扣除社保费以后才扣税那被公司扣了,公司是否违法?2011-04-2104:16:46广东广州",你好！可以申请工伤认定，然后享受工伤待遇；至于劳动关系，可以找一些相关的证据证明，比如工资条、工作卡、各种证件、录音等等，都可以。,未知
公司法人涉案被抓员工工资何处讨薪——公司法人涉案被抓，公司关闭法院刚下判决书已被判刑，那员工工资何处讨呢？,你说的情形如果属于未及时足额支付劳动报酬的，你可以解除劳动合同；反之，属于违约，如果劳动合同中有责任的约定，可以按照劳动合同的约定来要求用人单位承担。解除劳动合同，不要向什么部门提出，向用人单位提出就行了。,未知
"手机报-每天加班五个小时可拒绝不——手机报用户尾号4847--你好!我想知道是不是任何单位开除员工,都要把工资接算完,每天加班五个小时以上,可以拒绝不加班不?2011-03-0323:06:26重庆",你好！公司改工龄是为了规避法律，员工拒绝应当按劳动合同法给予补偿。,未知
没解除劳动关系公司不给安排工作怎么办——我是一名工人。我和公司没有解除劳动关系，公司不给我安排工作，也不给我解除劳动关系，甚至不给我缴纳养老保险，我找过劳动部门和劳动仲裁，社保机构，但都说管不了，请问律师我该怎么办,你可以向侵权人来支付你的医药费和误工费，这是一般的民事侵权，不能申请工伤。,未知
